{
  "$schema": "https://json-schema.org/draft/2020-12/schema",
  "$id": "https://example.invalid/lims-eln/observation-envelope/2.0.0",
  "title": "Comparative observation envelope",
  "type": "object",
  "required": [
    "envelope_version",
    "observation_id",
    "evidence_mode",
    "assurance_stage",
    "scenario_id",
    "source",
    "result",
    "provenance",
    "approvals",
    "classification"
  ],
  "properties": {
    "envelope_version": {"const": "2.0.0"},
    "observation_id": {
      "type": "string",
      "pattern": "^[A-Z][A-Z0-9]*(?:-[A-Z0-9]+)*$",
      "maxLength": 128
    },
    "evidence_mode": {"enum": ["planned", "simulated", "observed"]},
    "assurance_stage": {"enum": ["specified", "verified", "qualified", "validated", "accepted"]},
    "scenario_id": {
      "type": "string",
      "pattern": "^[A-Z][A-Z0-9]*(?:-[A-Z0-9]+)*$",
      "maxLength": 128
    },
    "source": {
      "type": "object",
      "required": ["environment_id", "implementation_commit", "configuration_digest", "database_release"],
      "properties": {
        "environment_id": {"$ref": "#/$defs/identity"},
        "implementation_commit": {"type": "string", "minLength": 1, "maxLength": 128},
        "simulation_commit": {"type": "string", "minLength": 1, "maxLength": 128},
        "configuration_digest": {"$ref": "#/$defs/sha256"},
        "database_release": {"$ref": "#/$defs/database_release_coordinate"},
        "future_reality_version": {
          "type": "string",
          "pattern": "^future-reality-[0-9]{4}-[0-9]{2}-[0-9]{2}-v[0-9]+$"
        },
        "closure_id": {
          "type": "string",
          "pattern": "^CLOSURE-[A-Z0-9]+(?:-[A-Z0-9]+)*$"
        },
        "governance_closure_digest": {"$ref": "#/$defs/sha256"},
        "aggregate_artifact_digest": {"$ref": "#/$defs/sha256"}
      },
      "additionalProperties": false
    },
    "result": {"type": "object"},
    "provenance": {
      "type": "object",
      "required": ["raw_artifact_digest", "governed_locator", "performed_by", "reviewed_by"],
      "properties": {
        "raw_artifact_digest": {"$ref": "#/$defs/sha256"},
        "governed_locator": {
          "type": "string",
          "pattern": "^[a-z][a-z0-9+.-]*://[^?#]+$",
          "maxLength": 512
        },
        "performed_by": {"$ref": "#/$defs/identity"},
        "reviewed_by": {"$ref": "#/$defs/identity"}
      },
      "additionalProperties": false
    },
    "approvals": {
      "type": "array",
      "items": {"$ref": "#/$defs/approval"},
      "maxItems": 24
    },
    "classification": {
      "type": "object",
      "required": ["data_class", "redaction_status"],
      "properties": {
        "data_class": {
          "enum": [
            "approved-synthetic-exemplar",
            "approved-synthetic-qualification",
            "redacted-confidential-manifest",
            "redacted-regulated-manifest",
            "synthetic"
          ]
        },
        "redaction_status": {
          "enum": ["generated-identities", "reviewed-redacted-manifest"]
        }
      },
      "additionalProperties": false
    }
  },
  "allOf": [
    {
      "if": {
        "properties": {"evidence_mode": {"const": "simulated"}},
        "required": ["evidence_mode"]
      },
      "then": {
        "properties": {
          "source": {
            "required": [
              "environment_id",
              "implementation_commit",
              "simulation_commit",
              "configuration_digest",
              "future_reality_version",
              "closure_id",
              "governance_closure_digest",
              "aggregate_artifact_digest"
            ],
            "properties": {
              "implementation_commit": {
                "pattern": "^[a-f0-9]{40}$"
              },
              "simulation_commit": {
                "pattern": "^[a-f0-9]{40}$"
              }
            }
          }
        }
      }
    },
    {
      "if": {
        "properties": {"evidence_mode": {"const": "observed"}},
        "required": ["evidence_mode"]
      },
      "then": {
        "properties": {
          "source": {
            "properties": {
              "implementation_commit": {
                "pattern": "^(?:[a-f0-9]{40}|[a-f0-9]{64})$"
              }
            }
          },
          "provenance": {
            "properties": {
              "governed_locator": {
                "pattern": "^(?:evidence-vault|s3)://[^/?#]+/[^?#%]+$"
              }
            }
          },
          "classification": {
            "properties": {
              "redaction_status": {"const": "reviewed-redacted-manifest"}
            }
          }
        }
      }
    }
  ],
  "$defs": {
    "sha256": {
      "type": "string",
      "pattern": "^sha256:[a-f0-9]{64}$"
    },
    "identity": {
      "type": "string",
      "pattern": "^[A-Za-z0-9][A-Za-z0-9._:@/-]{1,126}[A-Za-z0-9]$",
      "minLength": 3,
      "maxLength": 128
    },
    "governed_identity": {
      "type": "string",
      "pattern": "^[A-Z][A-Z0-9]*(?:-[A-Z0-9]+)*$",
      "maxLength": 128
    },
    "semantic_version": {
      "type": "string",
      "pattern": "^(?:0|[1-9][0-9]*)\\.(?:0|[1-9][0-9]*)\\.(?:0|[1-9][0-9]*)$"
    },
    "database_release_coordinate": {
      "type": "object",
      "required": [
        "oracle_id",
        "oracle_version",
        "database_release",
        "data_contract_id",
        "data_contract_version",
        "data_contract_digest",
        "migration_manifest_id",
        "migration_manifest_version",
        "migration_manifest_digest",
        "migration_mechanism_id",
        "migration_mechanism_version",
        "migration_mechanism_digest",
        "migration_history_relation",
        "migration_lock_strategy",
        "migration_transaction_strategy",
        "migration_receipt_id",
        "migration_receipt_digest",
        "release_receipt_id",
        "release_receipt_digest",
        "schema_digest",
        "semantic_policy_profile_id",
        "semantic_policy_profile_version",
        "semantic_policy_profile_digest",
        "semantic_policy_coverage"
      ],
      "properties": {
        "oracle_id": {"$ref": "#/$defs/governed_identity"},
        "oracle_version": {"$ref": "#/$defs/semantic_version"},
        "database_release": {
          "type": "string",
          "pattern": "^[a-z0-9]+(?:[.-][a-z0-9]+)*$"
        },
        "data_contract_id": {"$ref": "#/$defs/governed_identity"},
        "data_contract_version": {"$ref": "#/$defs/semantic_version"},
        "data_contract_digest": {"$ref": "#/$defs/sha256"},
        "migration_manifest_id": {"$ref": "#/$defs/governed_identity"},
        "migration_manifest_version": {"$ref": "#/$defs/semantic_version"},
        "migration_manifest_digest": {"$ref": "#/$defs/sha256"},
        "migration_mechanism_id": {"$ref": "#/$defs/governed_identity"},
        "migration_mechanism_version": {"$ref": "#/$defs/semantic_version"},
        "migration_mechanism_digest": {"$ref": "#/$defs/sha256"},
        "migration_history_relation": {
          "type": "string",
          "pattern": "^[a-z][a-z0-9_]{0,62}\\.[a-z][a-z0-9_]{0,62}$"
        },
        "migration_lock_strategy": {"$ref": "#/$defs/mechanism_strategy"},
        "migration_transaction_strategy": {"$ref": "#/$defs/mechanism_strategy"},
        "migration_receipt_id": {"$ref": "#/$defs/governed_identity"},
        "migration_receipt_digest": {"$ref": "#/$defs/sha256"},
        "release_receipt_id": {"$ref": "#/$defs/governed_identity"},
        "release_receipt_digest": {"$ref": "#/$defs/sha256"},
        "schema_digest": {"$ref": "#/$defs/sha256"},
        "semantic_policy_profile_id": {"$ref": "#/$defs/governed_identity"},
        "semantic_policy_profile_version": {"$ref": "#/$defs/semantic_version"},
        "semantic_policy_profile_digest": {"$ref": "#/$defs/sha256"},
        "semantic_policy_coverage": {"$ref": "#/$defs/semantic_policy_coverage"}
      },
      "additionalProperties": false
    },
    "semantic_policy_binding": {
      "type": "object",
      "required": ["policy_id", "representation_digest", "required_semantics"],
      "properties": {
        "policy_id": {"$ref": "#/$defs/governed_identity"},
        "representation_digest": {"$ref": "#/$defs/sha256"},
        "required_semantics": {
          "type": "array",
          "items": {"$ref": "#/$defs/mechanism_strategy"},
          "uniqueItems": true
        }
      },
      "additionalProperties": false
    },
    "semantic_policy_coverage": {
      "type": "object",
      "required": ["tenant", "temporal", "identity", "digest", "measurement", "unit"],
      "properties": {
        "tenant": {
          "allOf": [
            {"$ref": "#/$defs/semantic_policy_binding"},
            {"properties": {
              "policy_id": {"const": "DATA-TENANT-001"},
              "required_semantics": {"const": ["tenant_leading_composite_keys", "forced_row_level_security"]}
            }}
          ]
        },
        "temporal": {
          "allOf": [
            {"$ref": "#/$defs/semantic_policy_binding"},
            {"properties": {
              "policy_id": {"const": "DATA-TIME-001"},
              "required_semantics": {"const": ["occurrence_recording_distinct", "timezone_aware_instants", "finite_instants"]}
            }}
          ]
        },
        "identity": {
          "allOf": [
            {"$ref": "#/$defs/semantic_policy_binding"},
            {"properties": {
              "policy_id": {"const": "DATA-ID-001"},
              "required_semantics": {"const": ["internal_uuid", "external_constrained_source_scoped"]}
            }}
          ]
        },
        "digest": {
          "allOf": [
            {"$ref": "#/$defs/semantic_policy_binding"},
            {"properties": {
              "policy_id": {"const": "DATA-DIGEST-001"},
              "required_semantics": {"const": ["sha256_32_byte", "canonicalization_profile", "content_scope"]}
            }}
          ]
        },
        "measurement": {
          "allOf": [
            {"$ref": "#/$defs/semantic_policy_binding"},
            {"properties": {
              "policy_id": {"const": "DATA-MEASURE-001"},
              "required_semantics": {"const": ["raw_numeric_lexeme", "raw_value", "canonical_value", "assay_method_numeric_profile", "qualifier_reference_and_detection_limits"]}
            }}
          ]
        },
        "unit": {
          "allOf": [
            {"$ref": "#/$defs/semantic_policy_binding"},
            {"properties": {
              "policy_id": {"const": "DATA-UNIT-001"},
              "required_semantics": {"const": ["source_unit", "canonical_ucum", "vocabulary_version", "mapping_revision", "conversion_and_rounding_provenance"]}
            }}
          ]
        }
      },
      "additionalProperties": false
    },
    "mechanism_strategy": {
      "type": "string",
      "pattern": "^[a-z][a-z0-9]*(?:_[a-z0-9]+)*$",
      "maxLength": 96
    },
    "approval": {
      "type": "object",
      "required": ["domain", "decision", "approver"],
      "properties": {
        "domain": {
          "enum": ["engineering", "operations", "quality", "regulatory", "scientific", "security"]
        },
        "decision": {"enum": ["accept", "revise", "escalate"]},
        "approver": {"$ref": "#/$defs/identity"}
      },
      "additionalProperties": false
    }
  },
  "additionalProperties": false
}
