{
  "envelope_version": "2.0.0",
  "observation_id": "PLAN-ACCEPTANCE-CONTRACT-001",
  "evidence_mode": "planned",
  "assurance_stage": "specified",
  "scenario_id": "SPEC-ACCOUNTABLE-ACCEPTANCE-001",
  "source": {
    "environment_id": "acceptance-contract-surface",
    "implementation_commit": "planned-at-runtime",
    "configuration_digest": "sha256:6ace2029f0688baf278329b520391162762e5794aa78d570e9391acf4da524e6",
    "database_release": {
      "oracle_id": "ORACLE-DATABASE-FINAL-STATE-002",
      "oracle_version": "2.0.0",
      "database_release": "database-final-state-v2",
      "data_contract_id": "CONTRACT-LABORATORY-CORE-002",
      "data_contract_version": "2.0.0",
      "data_contract_digest": "sha256:9b88582b00ba65f96f8feddc42ab2da6a569d22e85ca8220b50494689c13f691",
      "migration_manifest_id": "PLAN-DATABASE-MIGRATIONS-002",
      "migration_manifest_version": "2.0.0",
      "migration_manifest_digest": "sha256:3a5e4850e689510c71b9c42bc487e5d59e72587c8dcf43f6c04355d1d9f984e1",
      "migration_mechanism_id": "FLYWAY",
      "migration_mechanism_version": "13.0.0",
      "migration_mechanism_digest": "sha256:031722729a3c47c61bc7a22db507975dfaa9c31138815977f82adb408b60563e",
      "migration_history_relation": "public.flyway_schema_history",
      "migration_lock_strategy": "flyway_postgresql_history_lock",
      "migration_transaction_strategy": "one_transaction_per_migration",
      "migration_receipt_id": "RECEIPT-DATABASE-MIGRATION-PLAN-002",
      "migration_receipt_digest": "sha256:eb8b51b4af72e3025ec6c3239c616047da2fee9326cdba4c06d91e708ce58207",
      "release_receipt_id": "RECEIPT-DATABASE-RELEASE-PLAN-002",
      "release_receipt_digest": "sha256:a287c790da713c5ca327f35d1076bdfe9b893774fe96c49d6ee7f92393e7ba11",
      "schema_digest": "sha256:1f9f23687a349876079f21063b9904b275933519eb442936056e780fa07101bd",
      "semantic_policy_profile_id": "PROFILE-DATABASE-SEMANTICS-002",
      "semantic_policy_profile_version": "2.0.0",
      "semantic_policy_profile_digest": "sha256:b76d71c7a99d2ba22ea3d55cbd9befa52c19574bdea6f0ff4c842e3d5f2b2542",
      "semantic_policy_coverage": {
        "tenant": {
          "policy_id": "DATA-TENANT-001",
          "representation_digest": "sha256:69c64005a1b7c2830c71e66abb88697093139c683f17d249b5d42ff17bab3299",
          "required_semantics": ["tenant_leading_composite_keys", "forced_row_level_security"]
        },
        "temporal": {
          "policy_id": "DATA-TIME-001",
          "representation_digest": "sha256:75e9ee7535e924601426f2adb7106afea294fac5904cfe09f76d3aeb17bf4eef",
          "required_semantics": ["occurrence_recording_distinct", "timezone_aware_instants", "finite_instants"]
        },
        "identity": {
          "policy_id": "DATA-ID-001",
          "representation_digest": "sha256:7985cd19c439751508761383d8211901137fe4feb31bd9e794b4fde7d4b5b680",
          "required_semantics": ["internal_uuid", "external_constrained_source_scoped"]
        },
        "digest": {
          "policy_id": "DATA-DIGEST-001",
          "representation_digest": "sha256:74986404c294bf80a96f98390137ef1ab43b6c3fdb6a35d714baed9c5906f653",
          "required_semantics": ["sha256_32_byte", "canonicalization_profile", "content_scope"]
        },
        "measurement": {
          "policy_id": "DATA-MEASURE-001",
          "representation_digest": "sha256:141e3240521a68ad6c597683eb9fd7f31e0192f7750740c5fac5c30fafeb82df",
          "required_semantics": ["raw_numeric_lexeme", "raw_value", "canonical_value", "assay_method_numeric_profile", "qualifier_reference_and_detection_limits"]
        },
        "unit": {
          "policy_id": "DATA-UNIT-001",
          "representation_digest": "sha256:eb4746bcb3f62453ff9eef406e5805860850c0c770df975953beb458e73fdc7b",
          "required_semantics": ["source_unit", "canonical_ucum", "vocabulary_version", "mapping_revision", "conversion_and_rounding_provenance"]
        }
      }
    }
  },
  "result": {
    "intended_use": "bounded synthetic exemplar",
    "scientific_fitness": "requires_environment_evidence",
    "quality_disposition": "requires_accountable_review",
    "regulatory_applicability": "requires_named_scope"
  },
  "provenance": {
    "raw_artifact_digest": "sha256:2a25b94af23a456bd0823b55067b45fe4f9d442b86b514c408116abd02cc64f6",
    "governed_locator": "synthetic-contract://planned/PLAN-ACCEPTANCE-CONTRACT-001",
    "performed_by": "contract-authoring-role",
    "reviewed_by": "contract-review-role"
  },
  "approvals": [],
  "classification": {
    "data_class": "synthetic",
    "redaction_status": "generated-identities"
  }
}
